asin,title,author,rating,reviews,url,description
0241258766,The Art of Statistics: Learning from Data,by DAVID SPIEGELHALTER | 27 February 2020,4.5 out of 5 stars,(4K),https://www.amazon.in/Statistics-Pelican-Books-David-Spiegelhalter/dp/0241258766/ref=sr_1_14?dib=eyJ2IjoiMSJ9.FrY15I3-sGdWOYj1_-4ongjsFIXjn1-TwOkEk2Ont2IlGQ_Jr02gJGyW9u0P4zQZEK8RJws-A3fjnweV1phpYexMgPhxCCpFDdjvB1Htx4T1dKxxshmW-8OnQ51vgdWUHrG6UTTUhJgaJcgehij2QSNHG_g0x64RKJCwJ5dkz8Hf7qzJSREp7-P8xafnv0qgKivqb96Ru4UL4W7EMGvYxIug3JDKhna37-sv1RmQZWY.j5DpIA1U7OJLA72GLISbig2wdem1QPEgbMmj23GDeds&dib_tag=se&keywords=data+science+book&qid=1776184900&sr=8-14,"'A statistical national treasure' Jeremy Vine, BBC Radio 2

'Required reading for all politicians, journalists, medics and anyone who tries to influence people (or is influenced) by statistics. A tour de force' Popular Science

Do busier hospitals have higher survival rates? How many trees are there on the planet? Why do old men have big ears? David Spiegelhalter reveals the answers to these and many other questions - questions that can only be addressed using statistical science.

Statistics has played a leading role in our scientific understanding of the world for centuries, yet we are all familiar with the way statistical claims can be sensationalised, particularly in the media. In the age of big data, as data science becomes established as a discipline, a basic grasp of statistical literacy is more important than ever.

In The Art of Statistics, David Spiegelhalter guides the reader through the essential principles we need in order to derive knowledge from data. Drawing on real world problems to introduce conceptual issues, he shows us how statistics can help us determine the luckiest passenger on the Titanic, whether serial killer Harold Shipman could have been caught earlier, and if screening for ovarian cancer is beneficial.

'Shines a light on how we can use the ever-growing deluge of data to improve our understanding of the world' Nature"
8194435005,"Practical Statistics for Data Scientists: 50+ Essential Concepts Using R and Python, Second Edition (Greyscale Indian Edition)","by Peter Bruce , Andrew Bruce, et al. | 15 June 2020",4.5 out of 5 stars,(1.2K),https://www.amazon.in/Practical-Statistics-Data-Scientists-Essential/dp/8194435005/ref=sr_1_15?dib=eyJ2IjoiMSJ9.FrY15I3-sGdWOYj1_-4ongjsFIXjn1-TwOkEk2Ont2IlGQ_Jr02gJGyW9u0P4zQZEK8RJws-A3fjnweV1phpYexMgPhxCCpFDdjvB1Htx4T1dKxxshmW-8OnQ51vgdWUHrG6UTTUhJgaJcgehij2QSNHG_g0x64RKJCwJ5dkz8Hf7qzJSREp7-P8xafnv0qgKivqb96Ru4UL4W7EMGvYxIug3JDKhna37-sv1RmQZWY.j5DpIA1U7OJLA72GLISbig2wdem1QPEgbMmj23GDeds&dib_tag=se&keywords=data+science+book&qid=1776184900&sr=8-15,"All Indian Reprints of O'Reilly are printed in Grayscale.

Statistical methods are a key part of data science, yet few data scientists have formal statistical training. Courses and books on basic statistics rarely cover the topic from a data science perspective. The second edition of this popular guide adds comprehensive examples in Python, provides practical guidance on applying statistical methods to data science, tells you how to avoid their misuse, and gives you advice on what’s important and what’s not.

Many data science resources incorporate statistical methods but lack a deeper statistical perspective. If you’re familiar with the R or Python programming languages and have some exposure to statistics, this quick reference bridges the gap in an accessible, readable format.

With this book, you’ll learn:

Why exploratory data analysis is a key preliminary step in data science
How random sampling can reduce bias and yield a higher-quality dataset, even with big data
How the principles of experimental design yield definitive answers to questions
How to use regression to estimate outcomes and detect anomalies
Key classification techniques for predicting which categories a record belongs to
Statistical machine learning methods that ""learn"" from data
Unsupervised learning methods for extracting meaning from unlabeled data"
9354640508,Introduction to Data Science:Practical Approach with R and Python,by B. Uma Maheswari and R. Sujatha | 1 October 2021,4.5 out of 5 stars,(114),https://www.amazon.in/Introduction-Data-Science-Practical-Approach/dp/9354640508/ref=sr_1_16?dib=eyJ2IjoiMSJ9.FrY15I3-sGdWOYj1_-4ongjsFIXjn1-TwOkEk2Ont2IlGQ_Jr02gJGyW9u0P4zQZEK8RJws-A3fjnweV1phpYexMgPhxCCpFDdjvB1Htx4T1dKxxshmW-8OnQ51vgdWUHrG6UTTUhJgaJcgehij2QSNHG_g0x64RKJCwJ5dkz8Hf7qzJSREp7-P8xafnv0qgKivqb96Ru4UL4W7EMGvYxIug3JDKhna37-sv1RmQZWY.j5DpIA1U7OJLA72GLISbig2wdem1QPEgbMmj23GDeds&dib_tag=se&keywords=data+science+book&qid=1776184900&sr=8-16,Introduction to Data Science: Practical Approach with R and Python covers all the fundamental concepts of Data Science in a concise manner. It gives a mix of insights and golden rules which would be needed in analyzing data. This book serves as a practical guide for Science/Engineering/MBA students – both at the undergraduate and postgraduate level interested in Data Science domain.
1636516025,"Machine Learning, Python & Data Analytics Essentials: Master AI, Data Science, and Analytics for Career Growth | Comprehensive Combo for Beginners & Professionals (Set of 3 Books)","by Dhairya Parikh , Shawn Peters , et al. | 21 July 2025",4.3 out of 5 stars,(15),https://www.amazon.in/Machine-Learning-Python-Analytics-Essentials/dp/1636516025/ref=sr_1_17?dib=eyJ2IjoiMSJ9.FrY15I3-sGdWOYj1_-4ongjsFIXjn1-TwOkEk2Ont2IlGQ_Jr02gJGyW9u0P4zQZEK8RJws-A3fjnweV1phpYexMgPhxCCpFDdjvB1Htx4T1dKxxshmW-8OnQ51vgdWUHrG6UTTUhJgaJcgehij2QSNHG_g0x64RKJCwJ5dkz8Hf7qzJSREp7-P8xafnv0qgKivqb96Ru4UL4W7EMGvYxIug3JDKhna37-sv1RmQZWY.j5DpIA1U7OJLA72GLISbig2wdem1QPEgbMmj23GDeds&dib_tag=se&keywords=data+science+book&qid=1776184900&sr=8-17,"Most data science journeys start with Python, move into data analytics, and lead to machine learning.
This combo brings all three together in one easy-to-follow package:

Python Essentials gives you coding confidence from scratch
Data Analytics Essentials teaches you how to find insights in data
Machine Learning Essentials shows you how to make predictions and automate decisions



What does each book offer?

Book 1: Machine Learning Essentials You Always Wanted to Know

Learn how data fuels modern machine learning systems, from training algorithms to making accurate predictions
Tackle complex topics like deep learning and neural networks—made easy with clear, beginner-friendly explanations
Discover how ML is applied in the real world, with examples from industries like healthcare, education, and more



Book 2: Python Essentials You Always Wanted to Know

Gain a solid foundation in Python, making it easier to progress to more advanced topics with simple and step-by-step explanations
Get a deep understanding of object-oriented programming principles, which are vital skills for writing clean, scalable, and reusable Python code
Stay ahead of the curve by diving into exciting fields like AI, Machine Learning, and IoT with Python



Book 3: Data Analytics Essentials You Always Wanted to Know

Get a clear understanding of key concepts, terminology, and the evolution of data analytics
Understand the transformative role of Big Data and how it reshapes industries globally
Explore how industry giants like Walmart and Netflix use data analytics to drive business decisions"
0143461729,Data Science: A Beginner's Guide,by C. Raju | 21 August 2023,4.2 out of 5 stars,(32),https://www.amazon.in/Data-Science-Beginners-Guid-Guide/dp/0143461729/ref=sr_1_18?dib=eyJ2IjoiMSJ9.FrY15I3-sGdWOYj1_-4ongjsFIXjn1-TwOkEk2Ont2IlGQ_Jr02gJGyW9u0P4zQZEK8RJws-A3fjnweV1phpYexMgPhxCCpFDdjvB1Htx4T1dKxxshmW-8OnQ51vgdWUHrG6UTTUhJgaJcgehij2QSNHG_g0x64RKJCwJ5dkz8Hf7qzJSREp7-P8xafnv0qgKivqb96Ru4UL4W7EMGvYxIug3JDKhna37-sv1RmQZWY.j5DpIA1U7OJLA72GLISbig2wdem1QPEgbMmj23GDeds&dib_tag=se&keywords=data+science+book&qid=1776184900&sr=8-18,"Data science is a perfect blend of 10 per cent maths, 20 per cent statistics, 30 per cent common sense and 40 per cent applied knowledge. While you can learn maths and statistics, you need to accumulate certain experience for common sense to kick in and apply what you have learnt.
This introductory book on data science builds upon an individual's innate knowledge and arms you with the tools to use this interdisciplinary academic field in everyday scenarios. With straightforward real-world examples and applications, it takes you on a path that may seem daunting but is made simple through Professor Raju's easy manner. It endows you with a holistic and flawless understanding of the fundamental principles required to build a solid foundation in data science."
9356817650,"GKP GATE 2026 Data Science & Artificial Intelligence Guide | Master General Aptitude, Engineering Mathematics, Technical & Core Concepts | 2600+ MCQs ... Paper 2024-2025 | With GATEflix Test Series",by G.K. Publications (P) Ltd. | 24 March 2025,4.2 out of 5 stars,(74),https://www.amazon.in/Artificial-Intelligence-Engineering-Mathematics-Technical/dp/9356817650/ref=sr_1_19?dib=eyJ2IjoiMSJ9.FrY15I3-sGdWOYj1_-4ongjsFIXjn1-TwOkEk2Ont2IlGQ_Jr02gJGyW9u0P4zQZEK8RJws-A3fjnweV1phpYexMgPhxCCpFDdjvB1Htx4T1dKxxshmW-8OnQ51vgdWUHrG6UTTUhJgaJcgehij2QSNHG_g0x64RKJCwJ5dkz8Hf7qzJSREp7-P8xafnv0qgKivqb96Ru4UL4W7EMGvYxIug3JDKhna37-sv1RmQZWY.j5DpIA1U7OJLA72GLISbig2wdem1QPEgbMmj23GDeds&dib_tag=se&keywords=data+science+book&qid=1776184900&sr=8-19,"The GATE is a gateway to top PG programs and prestigious PSU jobs. Want to stand out from the crowd? The GATE 2026 Study Guide is your ultimate prep companion!
What’s Inside?

All-in-One Coverage – Master General Aptitude, Engineering Mathematics, and Technical Section with ease.

Practice-Driven Learning – Exercises follow each topic, ensuring concept clarity and real exam readiness.

Real Exam Papers – Practice with solved papers from 2024 to 2025 and stay ahead of the curve.
Why Choose This Guide?
With its structured approach, in-depth explanations, and a wealth of practice material, this book ensures you’re not just prepared—you’re GATE-ready! Let’s make GATE 2026 your success story!"
9355517033,Learn Data Science from Scratch: Mastering ML and NLP with Python in a step-by-step approach,by Pratheerth Padman | 15 February 2024,4.7 out of 5 stars,(13),https://www.amazon.in/Learn-Science-Scratch-step-step/dp/9355517033/ref=sr_1_20?dib=eyJ2IjoiMSJ9.FrY15I3-sGdWOYj1_-4ongjsFIXjn1-TwOkEk2Ont2IlGQ_Jr02gJGyW9u0P4zQZEK8RJws-A3fjnweV1phpYexMgPhxCCpFDdjvB1Htx4T1dKxxshmW-8OnQ51vgdWUHrG6UTTUhJgaJcgehij2QSNHG_g0x64RKJCwJ5dkz8Hf7qzJSREp7-P8xafnv0qgKivqb96Ru4UL4W7EMGvYxIug3JDKhna37-sv1RmQZWY.j5DpIA1U7OJLA72GLISbig2wdem1QPEgbMmj23GDeds&dib_tag=se&keywords=data+science+book&qid=1776184900&sr=8-20,"Learn Data Science from Scratch equips you with the essential tools and techniques, from Python libraries to machine learning algorithms, to tackle real-world problems and make informed decisions. This book provides a thorough exploration of essential data science concepts, tools, and techniques. Starting with the fundamentals of data science, you will progress through data collection, web scraping, data exploration and visualization, and data cleaning and pre-processing. You will build the required foundation in statistics and probability before diving into machine learning algorithms, deep learning, natural language processing, recommender systems, and data storage systems. With hands-on examples and practical advice, each chapter offers valuable insights and key takeaways, empowering you to master the art of data-driven decision making."
9811619182,"Data Science and Sdgs: Challenges, Opportunities and Realities",by Bikas Kumar Sinha and Nurul Haque Mollah | 14 August 2021,,,https://www.amazon.in/sspa/click?ie=UTF8&spc=MTo2NDM2Njg4MDI3OTY0ODQyOjE3NzYxODQ5MDA6c3BfYnRmOjMwMDgyNTA4MjE5MjEzMjo6MDo6&url=%2FData-Science-SDGs-Challenges-Opportunities%2Fdp%2F9811619182%2Fref%3Dsr_1_21_sspa%3Fdib%3DeyJ2IjoiMSJ9.FrY15I3-sGdWOYj1_-4ongjsFIXjn1-TwOkEk2Ont2IlGQ_Jr02gJGyW9u0P4zQZEK8RJws-A3fjnweV1phpYexMgPhxCCpFDdjvB1Htx4T1dKxxshmW-8OnQ51vgdWUHrG6UTTUhJgaJcgehij2QSNHG_g0x64RKJCwJ5dkz8Hf7qzJSREp7-P8xafnv0qgKivqb96Ru4UL4W7EMGvYxIug3JDKhna37-sv1RmQZWY.j5DpIA1U7OJLA72GLISbig2wdem1QPEgbMmj23GDeds%26dib_tag%3Dse%26keywords%3Ddata%2Bscience%2Bbook%26qid%3D1776184900%26sr%3D8-21-spons%26aref%3DWLSs4g0HLT%26sp_csd%3Dd2lkZ2V0TmFtZT1zcF9idGY%26psc%3D1&aref=WLSs4g0HLT&sp_cr=ZAZ,"The book presents contributions on statistical models and methods applied, for both data science and SDGs, in one place. Measuring and controlling data of SDGs, data driven measurement of progress needs to be distributed to stakeholders. In this situation, the techniques used in data science, specially, in the big data analytics, play an important role rather than the traditional data gathering and manipulation techniques. This book fills this space through its twenty contributions. The contributions have been selected from those presented during the 7th International Conference on Data Science and Sustainable Development Goals organized by the Department of Statistics, University of Rajshahi, Bangladesh; and cover topics mainly on SDGs, bioinformatics, public health, medical informatics, environmental statistics, data science and machine learning.

The contents of the volume would be useful to policymakers, researchers, government entities, civil society, and nonprofit organizations for monitoring and accelerating the progress of SDGs."
9356685207,Data Science and Artificial Intelligence for Beginners,by Dr. D.Venu Gopal | 17 October 2022,4.2 out of 5 stars,(12),https://www.amazon.in/sspa/click?ie=UTF8&spc=MTo2NDM2Njg4MDI3OTY0ODQyOjE3NzYxODQ5MDA6c3BfYnRmOjIwMTAxNDc4NzYwMTk4OjowOjo&url=%2FData-Science-Artificial-Intelligence-Beginners%2Fdp%2F9356685207%2Fref%3Dsr_1_22_sspa%3Fdib%3DeyJ2IjoiMSJ9.FrY15I3-sGdWOYj1_-4ongjsFIXjn1-TwOkEk2Ont2IlGQ_Jr02gJGyW9u0P4zQZEK8RJws-A3fjnweV1phpYexMgPhxCCpFDdjvB1Htx4T1dKxxshmW-8OnQ51vgdWUHrG6UTTUhJgaJcgehij2QSNHG_g0x64RKJCwJ5dkz8Hf7qzJSREp7-P8xafnv0qgKivqb96Ru4UL4W7EMGvYxIug3JDKhna37-sv1RmQZWY.j5DpIA1U7OJLA72GLISbig2wdem1QPEgbMmj23GDeds%26dib_tag%3Dse%26keywords%3Ddata%2Bscience%2Bbook%26qid%3D1776184900%26sr%3D8-22-spons%26aref%3DINkDpVzlv0%26sp_csd%3Dd2lkZ2V0TmFtZT1zcF9idGY%26psc%3D1&aref=INkDpVzlv0&sp_cr=ZAZ,"About the Book: The book basically will focus on the importance of Data Science and Artificial Intelligence Learning in the real world and also focus on the various applications of the same. This will help the beginners to generate interest in learning and also helps in understanding where the concepts are to be used.

About the Author: The Authors are dedicated academicians with good experience in teaching to the engineering students as well as in research work."
